{
  "kind": "semanticProfile",
  "id": "cibseven-2.2.0-serial-business-tasks-draft",
  "status": "draft",
  "claim": "bpmn-2.0.2-serial-business-task-composition-with-classified-cib-extensions",
  "normativeAuthority": {
    "name": "OMG Business Process Model and Notation",
    "version": "2.0.2",
    "references": [
      "Clause 13.2",
      "Clause 13.3.2",
      "Clause 13.3.3"
    ]
  },
  "bpmn": {
    "process": "private-executable",
    "features": [
      "none-start-event",
      "user-task",
      "user-task-discovery",
      "user-task-instance-completion",
      "user-task-literal-group-candidate-metadata",
      "user-task-generated-form-field-metadata",
      "process-start-string-null-data",
      "user-task-string-null-completion-data",
      "service-task",
      "named-activity-effect",
      "enclosing-string-null-input-snapshot",
      "literal-input-mapping",
      "exact-string-null-local-result-patch",
      "local-variable-output-mapping",
      "required-start-input-presence",
      "fresh-task-and-effect-occurrences",
      "none-end-event",
      "sequence-flow",
      "process-completion",
      "finite-serial-user-service-task-chain",
      "successful-effect-result"
    ],
    "extensions": [
      "runtime-service-process-start-variable-map",
      "task-service-process-variable-completion-patch",
      "camunda-user-task-literal-candidate-group",
      "camunda-user-task-generated-form-field",
      "camunda-delegate-expression-exact-business-operation-token",
      "camunda-async-before-continuation",
      "camunda-input-output-enclosing-input-local-output",
      "bpmn-lean-content-bound-source-overlay-effect-binding"
    ],
    "relationships": [
      "CIB-AGR-0001",
      "CIB-AGR-0002",
      "CIB-EXT-0005",
      "CIB-EXT-0006",
      "CIB-EXT-0011",
      "CIB-EXT-0012",
      "CIB-EXT-0015",
      "CIB-OP-0001"
    ]
  },
  "observations": [
    "deployment",
    "commandResults",
    "processStatus",
    "activeWaits",
    "openUserTasks",
    "openTimers",
    "openEffects",
    "variables",
    "enabledInteractions",
    "logicalTime"
  ],
  "comparison": {
    "trace": "exact-after-canonical-projection",
    "semanticConcurrency": false
  },
  "excluded": [
    "whole-profile-cib-equivalence",
    "cib-juel-compatibility-claim",
    "general-juel",
    "arbitrary-beans",
    "java-delegate-interoperability",
    "engine-context-and-handler-shadowing-variable-names",
    "missing-required-start-inputs",
    "input-local-chaining",
    "parent-output-fallback",
    "implicit-task-split-merge",
    "concurrent-control-units",
    "nested-scopes",
    "call-activities",
    "multi-instance",
    "standard-resource-roles",
    "standard-renderings",
    "multiple-candidates-or-form-fields",
    "boolean-form-field-metadata",
    "form-labels-defaults-constraints-properties",
    "form-rendering",
    "form-validation",
    "claiming-and-authorization",
    "standard-data-associations",
    "variable-values-beyond-string-null",
    "scripts",
    "listeners",
    "semantic-incidents-and-retry",
    "semantic-cancellation",
    "compensation",
    "transactions",
    "cib-transaction-timing-equivalence",
    "exactly-once-external-effects",
    "gateways",
    "cycles",
    "boundary-events",
    "business-error-results"
  ]
}
