{
  "kind": "semanticProfile",
  "id": "cibseven-2.2.0-user-task-draft",
  "status": "draft",
  "claim": "user-task-interaction-calibration-only",
  "oracle": {
    "name": "CIB Seven",
    "version": "2.2.0",
    "revision": "834a9874760de8a0107f7c1b32806e37f17fb017"
  },
  "environment": {
    "java": "21",
    "database": "H2 2.3.232",
    "automaticJobExecutor": "disabled",
    "clock": "explicit",
    "historyLevel": "audit",
    "defaultHistoryTimeToLive": "P180D",
    "enforceHistoryTimeToLive": true
  },
  "bpmn": {
    "process": "private-executable",
    "features": [
      "none-start-event",
      "user-task",
      "user-task-discovery",
      "user-task-instance-completion",
      "none-end-event",
      "sequence-flow",
      "process-completion"
    ],
    "extensions": [],
    "relationships": [
      "CIB-AGR-0001",
      "CIB-AGR-0002",
      "CIB-OP-0001",
      "CIB-CFG-0001"
    ]
  },
  "observations": [
    "deployment",
    "commandResults",
    "processStatus",
    "activeWaits",
    "openUserTasks",
    "openTimers",
    "openEffects",
    "enabledInteractions",
    "logicalTime"
  ],
  "comparison": {
    "trace": "exact-after-canonical-projection",
    "semanticConcurrency": false
  },
  "excluded": [
    "claiming",
    "assignment",
    "authorization",
    "forms",
    "variables",
    "expressions",
    "gateways",
    "timers",
    "messages",
    "boundary-events",
    "event-subprocesses",
    "multi-instance",
    "compensation",
    "listeners",
    "history",
    "search-attributes",
    "global-task-inbox",
    "external-services",
    "vendor-extensions"
  ]
}
